{
  "problem_information": {
    "problem_id": "IMO-SL-2006-A3",
    "contest": "IMO Shortlist",
    "year": 2006,
    "round": "Shortlist",
    "problem_number": "A3",
    "category": "Algebra",
    "difficulty": null,
    "source": "data/raw/imo/IMO2006SL.pdf (official Shortlisted Problems with Solutions)"
  },
  "problem": {
    "problem_statement": "The sequence c_0, c_1, …, c_n, … is defined by c_0 = 1, c_1 = 0 and c_{n+2} = c_{n+1} + c_n for n ≥ 0. Consider the set S of ordered pairs (x, y) for which there is a finite set J of positive integers such that x = ∑_{j∈J} c_j , y = ∑_{j∈J} c_{j-1}. Prove that there exist real numbers α, β and m, M with the following property: An ordered pair of nonnegative integers (x, y) satisfies the inequality m < αx + βy < M if and only if (x, y) ∈ S.\n\nN.B. A sum over the elements of the empty set is assumed to be 0.\n(Russia)"
  },
  "solutions": {
    "official_solutions": [
      {
        "solution_id": "official_solution_1",
        "label": "Official Solution",
        "text": "Let φ = (1 + √5)/2 and ψ = (1 − √5)/2 be the roots of the quadratic equation t^2 − t − 1 = 0. So φψ = −1, φ + ψ = 1 and 1 + ψ = ψ^2. An easy induction shows that the general term c_n of the given sequence satisfies\n\nc_n = (φ^{n−1} − ψ^{n−1}) / (φ − ψ) for n ≥ 0.\n\nSuppose that the numbers α and β have the stated property, for appropriately chosen m and M. Since (c_n, c_{n−1}) ∈ S for each n, the expression α c_n + β c_{n−1} is bounded as n grows to infinity. Because φ > 1 and −1 < ψ < 0, this implies αφ + β = 0.\n\nTo satisfy αφ + β = 0, one can set for instance α = ψ, β = 1. We now find the required m and M for this choice of α and β.\n\nNote first that the above displayed equation gives c_n ψ + c_{n−1} = ψ^{n−1}, n ≥ 1. In the sequel, we denote the pairs in S by (a_J, b_J), where J is a finite subset of the set N of positive integers and a_J = ∑_{j∈J} c_j , b_J = ∑_{j∈J} c_{j−1}. Since ψ a_J + b_J = ∑_{j∈J} (c_j ψ + c_{j−1}), we obtain\n\nψ a_J + b_J = ∑_{j∈J} ψ^{j−1} for each (a_J, b_J) ∈ S. (1)\n\nOn the other hand, in view of −1 < ψ < 0,\n\n−1 = ψ/(1 − ψ^2) = ∑_{j=0}^∞ ψ^{2j+1} < ∑_{j∈J} ψ^{j−1} < ∑_{j=0}^∞ ψ^{2j} = 1/(1 − ψ^2) = 1 − ψ = φ.\n\nTherefore, according to (1),\n\n−1 < ψ a_J + b_J < φ for each (a_J, b_J) ∈ S.\n\nThus m = −1 and M = φ is an appropriate choice.\n\nConversely, we prove that if an ordered pair of nonnegative integers (x, y) satisfies the inequality −1 < ψx + y < φ then (x, y) ∈ S.\n\nLemma. Let x, y be nonnegative integers such that −1 < ψx + y < φ. Then there exists a subset J of N such that ψx + y = ∑_{j∈J} ψ^{j−1}. (2)\n\nProof. For x = y = 0 it suffices to choose the empty subset of N as J, so let at least one of x, y be nonzero. There exist representations of ψx + y of the form ψx + y = ψ^{i_1} + ··· + ψ^{i_k} where i_1 ≤ ··· ≤ i_k is a sequence of nonnegative integers, not necessarily distinct. For instance, we can take x summands ψ^1 = ψ and y summands ψ^0 = 1. Consider all such representations of minimum length k and focus on the ones for which i_1 has the minimum possible value j_1. Among them, consider the representations where i_2 has the minimum possible value j_2. Upon choosing j_3, …, j_k analogously, we obtain a sequence j_1 ≤ ··· ≤ j_k which clearly satisfies ψx + y = ∑_{r=1}^k ψ^{j_r}. To prove the lemma, it suffices to show that j_1, …, j_k are pairwise distinct.\n\nSuppose on the contrary that j_r = j_{r+1} for some r = 1, …, k − 1. Let us consider the case j_r ≥ 2 first. Observing that 2ψ^2 = 1 + ψ^3, we replace j_r and j_{r+1} by j_r − 2 and j_r + 1, respectively. Since ψ^{j_r} + ψ^{j_{r+1}} = 2ψ^{j_r} = ψ^{j_r−2}(1 + ψ^3) = ψ^{j_r−2} + ψ^{j_r+1}, the new sequence also represents ψx + y as needed, and the value of i_r in it contradicts the minimum choice of j_r.\n\nLet j_r = j_{r+1} = 0. Then the sum contains at least two summands equal to ψ^0 = 1. On the other hand j_s ≠ 1 for all s, because the equality 1 + ψ = ψ^2 implies that a representation of minimum length cannot contain consecutive i_r’s. It follows that ψx + y > 2 + ψ^3 + ψ^5 + ψ^7 + ··· = 2 − ψ^2 = φ, contradicting the condition of the lemma.\n\nLet j_r = j_{r+1} = 1; then the sum contains at least two summands equal to ψ. Like in the case j_r = j_{r+1} = 0, we also infer that j_s ≠ 0 and j_s ≠ 2 for all s. Therefore ψx + y < 2ψ + ψ^4 + ψ^6 + ψ^8 + ··· = 2ψ − ψ^3 = −1, which is a contradiction again. The conclusion follows.\n\nNow let the ordered pair (x, y) satisfy −1 < ψx + y < φ; hence the lemma applies to (x, y). Let J ⊂ N be such that (2) holds. Comparing (1) and (2), we conclude that ψx + y = ψ a_J + b_J. Now, x, y, a_J and b_J are integers, and ψ is irrational. So the last equality implies x = a_J and y = b_J. This shows that the numbers α = ψ, β = 1, m = −1, M = φ meet the requirements.",
        "source_reference": "pdf:IMO2006SL.pdf; pdf_pages:11-12; printed_pages:10-11; heading:Solution."
      },
      {
        "solution_id": "official_comment_lemma_induction",
        "label": "Official Comment — alternate inductive proof of the Lemma",
        "text": "Comment. We present another way to prove the lemma, constructing the set J inductively. For x = y = 0, choose J = ∅. We induct on n = 3x + 2y. Suppose that an appropriate set J exists when 3x + 2y < n. Now assume 3x + 2y = n > 0. The current set J should be either 1 ≤ j_1 < j_2 < ··· < j_k or j_1 = 0, 1 ≤ j_2 < ··· < j_k.\n\nThese sets fulfil the condition if (ψx + y)/ψ = ψ^{i_1−1} + ··· + ψ^{i_k−1} or (ψx + y − 1)/ψ = ψ^{i_2−1} + ··· + ψ^{i_k−1}, respectively; therefore it suffices to find an appropriate set for (ψx + y)/ψ or (ψx + y − 1)/ψ, respectively.\n\nConsider (ψx + y)/ψ. Knowing that (ψx + y)/ψ = x + (ψ − 1)y = ψ y + (x − y), let x' = y, y' = x − y and test the induction hypothesis on these numbers. We require (ψx + y)/ψ ∈ (−1, φ), which is equivalent to ψx + y ∈ (φ·ψ, (−1)·ψ) = (−1, −ψ). (3)\nRelation (3) implies y' = x − y ≥ −ψx − y > ψ > −1; therefore x', y' ≥ 0. Moreover, 3x' + 2y' = 2x + y ≤ (3/2)n; therefore, if (3) holds then the induction applies.\n\nNow consider (ψx + y − 1)/ψ. Since (ψx + y − 1)/ψ = x + (ψ − 1)(y − 1) = ψ(y − 1) + (x − y + 1), we set x' = y − 1 and y' = x − y + 1. Again we require that (ψx + y − 1)/ψ ∈ (−1, φ), i.e. ψx + y ∈ (φ·ψ + 1, (−1)·ψ + 1) = (0, φ). (4)\nIf (4) holds then y − 1 ≥ ψx + y − 1 > −1 and x − y + 1 ≥ −ψx − y + 1 > −φ + 1 > −1, therefore x', y' ≥ 0. Moreover, 3x' + 2y' = 2x + y − 1 < (3/2)n and the induction works.\n\nFinally, (−1, −ψ) ∪ (0, φ) = (−1, φ) so at least one of (3) and (4) holds and the induction step is justified.",
        "source_reference": "pdf:IMO2006SL.pdf; pdf_pages:12-13; printed_pages:11-12; heading:Comment."
      }
    ],
    "solution_summary": "Identify φ,ψ as roots of t^2−t−1=0 and write c_n via Binet. Boundedness of α c_n + β c_{n−1} forces αφ+β=0; choose α=ψ, β=1. Then pairs in S satisfy −1 < ψx + y < φ. Conversely, a lemma produces a distinct-power expansion of ψx+y as ∑ ψ^{j−1}, which matches the S-generating sum and yields (x,y)∈S by irrationality of ψ."
  },
  "understanding": {
    "concepts": [
      "linear recurrence",
      "Fibonacci-like sequence",
      "golden ratio conjugates",
      "Binet formula",
      "linear forms and bounded strips",
      "unique representation / Zeckendorf-like idea"
    ],
    "subconcepts": [
      "characteristic equation t^2 − t − 1 = 0",
      "geometric series bounds for |ψ|<1",
      "minimum-length multisets of powers of ψ",
      "irrationality implying coefficient uniqueness"
    ],
    "prerequisites": [
      "induction",
      "roots of quadratic equations",
      "geometric series",
      "basic properties of irrational numbers"
    ]
  },
  "problem_dna": {
    "problem_dna": null,
    "problem_family": null,
    "problem_template": null,
    "construction_type": null
  },
  "thinking": {
    "thinking_graph": {
      "graph_version": "1.0.0",
      "solution_id": "official_solution_1",
      "nodes": [
        {
          "node_id": "N1",
          "node_type": "given",
          "importance": "supporting",
          "statement": "Sequence: c_0=1, c_1=0, c_{n+2}=c_{n+1}+c_n for n≥0. S = {(∑_{j∈J} c_j, ∑_{j∈J} c_{j−1}) : J finite ⊂ positive integers}, with the empty sum equal to 0.",
          "purpose": "Fix the exact objects everything else refers to — the sequence, its initial values, and how a finite index set J generates a pair in S — so later symbols like c_n, a_J, b_J are unambiguous.",
          "source_span": "pdf:IMO2006SL.pdf; pdf_page:11; printed_page:10; problem statement A3",
          "depends_on": []
        },
        {
          "node_id": "N2",
          "node_type": "goal",
          "importance": "critical",
          "statement": "Exist reals α,β,m,M such that for nonnegative integers (x,y): m < αx+βy < M ⇔ (x,y)∈S.",
          "purpose": "State exactly what must be produced: a single linear inequality that is an if-and-only-if test for membership in S, not merely an inequality that happens to hold on S.",
          "source_span": "pdf:IMO2006SL.pdf; pdf_page:11; printed_page:10; problem statement goal sentence",
          "depends_on": [
            "N1"
          ]
        },
        {
          "node_id": "N3",
          "node_type": "definition",
          "importance": "critical",
          "statement": "φ=(1+√5)/2 and ψ=(1−√5)/2 are the two roots of t²−t−1=0 — the characteristic equation of the recurrence c_{n+2}=c_{n+1}+c_n.",
          "purpose": "Introduce the two constants whose contrasting sizes (φ>1, −1<ψ<0) will let a linear form be bounded on S; using exactly this equation is dictated by the recurrence's own coefficients in N1, not an arbitrary choice.",
          "source_span": "pdf:IMO2006SL.pdf; pdf_page:11; printed_page:10; Solution opening paragraph",
          "depends_on": [
            "N1"
          ]
        },
        {
          "node_id": "N4",
          "node_type": "observation",
          "importance": "critical",